{
  "$schema": "https://json-schema.org/draft/2020-12/schema",
  "$id": "https://example.local/schemas/task.schema.json",
  "title": "Frontend Agent Evaluation Task",
  "type": "object",
  "required": [
    "schemaVersion",
    "id",
    "version",
    "title",
    "environment",
    "budget",
    "permissions",
    "commands",
    "evaluation"
  ],
  "properties": {
    "schemaVersion": {
      "type": "integer",
      "minimum": 1
    },
    "id": {
      "type": "string",
      "pattern": "^[a-z0-9][a-z0-9-]+$"
    },
    "version": {
      "type": "integer",
      "minimum": 1
    },
    "title": {
      "type": "string",
      "minLength": 1
    },
    "tags": {
      "type": "object",
      "properties": {
        "framework": {
          "type": "string",
          "minLength": 1
        },
        "language": {
          "type": "string",
          "minLength": 1
        },
        "taskType": {
          "type": "string",
          "minLength": 1
        },
        "difficulty": {
          "type": "integer",
          "minimum": 1,
          "maximum": 5
        },
        "capabilities": {
          "type": "array",
          "items": {
            "type": "string",
            "minLength": 1
          },
          "uniqueItems": true
        }
      },
      "additionalProperties": false
    },
    "environment": {
      "type": "object",
      "required": [
        "image",
        "repositoryCommit",
        "packageManager",
        "locale",
        "timezone",
        "network"
      ],
      "properties": {
        "image": {
          "type": "string",
          "minLength": 1
        },
        "repositoryCommit": {
          "type": "string",
          "minLength": 1
        },
        "packageManager": {
          "type": "string",
          "minLength": 1
        },
        "locale": {
          "type": "string",
          "minLength": 1
        },
        "timezone": {
          "type": "string",
          "minLength": 1
        },
        "network": {
          "type": "string",
          "minLength": 1
        },
        "mockApi": {
          "type": "object",
          "required": ["image", "command", "port"],
          "properties": {
            "image": { "type": "string", "pattern": "@sha256:[a-f0-9]{64}$" },
            "command": { "type": "array", "minItems": 1, "items": { "type": "string", "minLength": 1 } },
            "port": { "type": "integer", "minimum": 1, "maximum": 65535 }
          },
          "additionalProperties": false
        },
        "packageProxy": {
          "type": "object",
          "required": ["image", "command", "port", "fixtureDirectory"],
          "properties": {
            "image": { "type": "string", "pattern": "@sha256:[a-f0-9]{64}$" },
            "command": { "type": "array", "minItems": 1, "items": { "type": "string", "minLength": 1 } },
            "port": { "type": "integer", "minimum": 1, "maximum": 65535 },
            "fixtureDirectory": { "type": "string", "minLength": 1 }
          },
          "additionalProperties": false
        }
      },
      "additionalProperties": false
    },
    "viewports": {
      "type": "array",
      "items": {
        "type": "object",
        "required": [
          "name",
          "width",
          "height"
        ],
        "properties": {
          "name": {
            "type": "string",
            "minLength": 1
          },
          "width": {
            "type": "integer",
            "minimum": 1
          },
          "height": {
            "type": "integer",
            "minimum": 1
          }
        },
        "additionalProperties": false
      }
    },
    "budget": {
      "type": "object",
      "required": [
        "maxWallTimeSeconds",
        "maxAgentSteps",
        "maxCostUsd"
      ],
      "properties": {
        "maxWallTimeSeconds": {
          "type": "integer",
          "minimum": 1
        },
        "maxAgentSteps": {
          "type": "integer",
          "minimum": 1
        },
        "maxCostUsd": {
          "type": "number",
          "minimum": 0
        }
      },
      "additionalProperties": false
    },
    "permissions": {
      "type": "object",
      "required": [
        "writablePaths",
        "forbiddenPaths",
        "allowDependencyChanges"
      ],
      "properties": {
        "writablePaths": {
          "type": "array",
          "items": {
            "type": "string",
            "minLength": 1
          },
          "uniqueItems": true
        },
        "forbiddenPaths": {
          "type": "array",
          "items": {
            "type": "string",
            "minLength": 1
          },
          "uniqueItems": true
        },
        "allowDependencyChanges": {
          "type": "boolean"
        }
      },
      "additionalProperties": false
    },
    "commands": {
      "type": "object",
      "required": [
        "install",
        "typecheck",
        "lint",
        "test",
        "build",
        "start"
      ],
      "properties": {
        "install": {
          "type": "string",
          "minLength": 1
        },
        "typecheck": {
          "type": "string",
          "minLength": 1
        },
        "lint": {
          "type": "string",
          "minLength": 1
        },
        "test": {
          "type": "string",
          "minLength": 1
        },
        "build": {
          "type": "string",
          "minLength": 1
        },
        "start": {
          "type": "string",
          "minLength": 1
        }
      },
      "additionalProperties": false
    },
    "evaluation": {
      "type": "object",
      "required": [
        "requiredGates",
        "weights"
      ],
      "properties": {
        "requiredGates": {
          "type": "object",
          "required": [
            "integrity",
            "build",
            "criticalFunctionalTests"
          ],
          "properties": {
            "integrity": {
              "type": "boolean"
            },
            "build": {
              "type": "boolean"
            },
            "criticalFunctionalTests": {
              "type": "boolean"
            }
          },
          "additionalProperties": false
        },
        "weights": {
          "type": "object",
          "required": [
            "functional",
            "visual",
            "responsive",
            "accessibility",
            "engineering"
          ],
          "properties": {
            "functional": {
              "type": "number",
              "minimum": 0,
              "maximum": 1
            },
            "visual": {
              "type": "number",
              "minimum": 0,
              "maximum": 1
            },
            "responsive": {
              "type": "number",
              "minimum": 0,
              "maximum": 1
            },
            "accessibility": {
              "type": "number",
              "minimum": 0,
              "maximum": 1
            },
            "engineering": {
              "type": "number",
              "minimum": 0,
              "maximum": 1
            }
          },
          "additionalProperties": false
        },
        "buildOutputPaths": {
          "type": "array",
          "items": { "type": "string", "minLength": 1 },
          "uniqueItems": true
        }
      },
      "additionalProperties": false
    },
    "extensions": {
      "type": "object",
      "additionalProperties": true
    }
  },
  "additionalProperties": false
}
